### ISSUE TITLE
Error from bufferevent: Connection reset by peer

### ISSUE THREAD

**Issue by recoilme** [libevent/libevent#453]
Hello
I write simple http server for testing libevent - based on example echo server from guide.

I am sure what code dont has any error in parsing.
Gist: https://gist.github.com/recoilme/5ee1ec6e2c8e2c9598b8d98f9603b454

But then i test it with wrk - i see many errors in stress mode in logs:
Error from bufferevent: Connection reset by peer

Output wrk log:
```
wrk -t 5 -c 1000 http://127.0.0.1:9876/
Running 10s test @ http://127.0.0.1:9876/
  5 threads and 1000 connections
  Thread Stats   Avg      Stdev     Max   +/- Stdev
    Latency    23.06ms   12.43ms 103.07ms   70.00%
    Req/Sec     4.93k     1.63k   10.69k    75.20%
  246287 requests in 10.07s, 37.11MB read
  Socket errors: connect 0, read 979, write 0, timeout 0
Requests/sec:  24460.38
Transfer/sec:      3.69MB
```
I use last stable release libevent-2.1.8-stable
on mac os sierra

Is it problem in bufferevent or i miss some settings?
Please, help(

**Comment by ploxiln** [comment]
macOS by default limits processes to 256 file descriptors. 1000 connections requires 1000 file descriptors. You can change this for a bash shell session with the command `ulimit -n 2048`, for example.

**Comment by recoilme** [comment]
@ploxiln thanks for your reply, but looks like its not os depended problem. I try increase limits on mac with same result. And test on 32 cores latest debian (without any limits):
```
wrk -t 2 -c 250 http://127.0.0.1:9876/
Running 10s test @ http://127.0.0.1:9876/
  2 threads and 250 connections
  Thread Stats   Avg      Stdev     Max   +/- Stdev
    Latency     2.61ms  301.21us   6.72ms   84.65%
    Req/Sec    47.75k     3.21k   56.20k    80.00%
  950064 requests in 10.00s, 144.06MB read
Requests/sec:  94975.66
Transfer/sec:     14.40MB
Error from bufferevent: Connection reset by peer
Error from bufferevent: Connection reset by peer
Error from bufferevent: Connection reset by peer
```

I see this error only then more then one thread used. I see similar type of error from scala multithreaded app then do get requests to multithreaded server based on libevent. More threads - more errors. So i decide competly rewrite server- without multithread, as simple as possible  and see same kind of errors. So  - i dont think what its OS specific problem(

**Comment by ploxiln** [comment]
Without spending too much time reviewing your code - it's buggy code.

```c
static char 
msg_ok[] =
        "HTTP/1.1 200 OK\r\n"
        "Connection: Keep-Alive\r\n"
        "Content-Type: text/html; charset=UTF-8\r\n"
        "Content-Length: %d\r\n"
        "Keep-Alive: timeout=10, max=20\r\n"
        "Server: okdb/0.0.1\r\n"
"\r\n%s";


static void
send_response(struct evbuffer *output, const char *msg)
{
    int resp_size = ((sizeof(msg_ok)) -2*2/* % exclude */) + strlen(msg) + get_int_len(strlen(msg));
                
    char *resp = malloc(resp_size);
    resp[resp_size] = '\0';
    snprintf(resp, resp_size,msg_ok, strlen(msg),msg);
    evbuffer_add(output, resp, resp_size-1);
    free(resp);
}
```

First, `resp[resp_size] = '\0';` writes one byte past the end of the `malloc()`ed buffer. Usually you'll get away with that. Then, `evbuffer_add(output, resp, resp_size-1);` skips the last byte of the message. That could be your problem. But there could be a few other problems too...

**Comment by azat** [comment]
Hi!

Can you run you program under `strace/truss -f`? And upload output
somewhere?

**Comment by azat** [comment]
And @ploxiln is right, there is a bug, if you run under valgind (or compile with `-fsanitize=address`) you will see "invalid write", for next lines:

```c
char *ptr = malloc(10);
ptr[10] = '\0';
```

**Comment by azat** [comment]
And indeed it is ECONNRESET:

```
2803  readv(44, 0x7ffefc4b9b00, 1)      = -1 ECONNRESET (Connection reset by peer)
2803  epoll_ctl(3, EPOLL_CTL_DEL, 44, 0x7ffefc4b9a40) = 0
2803  dup(2)                            = 258
2803  fcntl(258, F_GETFL)               = 0x8002 (flags O_RDWR|O_LARGEFILE)
2803  fstat(258, {st_mode=S_IFCHR|0620, st_rdev=makedev(136, 117), ...}) = 0
2803  write(258, "Error from bufferevent: Connection reset by peer\n", 49) = 49
```

**Comment by ploxiln** [comment]
Consider, also, that your code only parses requests that start with `GET /` with exactly one space, and only responds of the request path is exactly `/` ... these things _probably_ are fine for the test with wrk, they are probably not "the" problem, but it's hard to be 100% sure. And your code only cleanly closes the connection if it receives `quit\r\n` which I'm not sure wrk sends. Most likely wrk is resetting the connection when it can't make sense of what your program is sending it.

**Comment by azat** [comment]
Hm `wrk` doesn't close fds correctly:
```
2916  read(226, "HTTP/1.1 200 OK\r\nConnection: Keep-Alive\r\nContent-Type: text/html; charset=UTF-8\r\nContent-Length: 4\r\nKeep-Alive: timeout=10, max=20\r\nServer: okdb/0.0.1\r\n\r\nOK\r\n", 8192) = 158
2916  epoll_ctl(3, EPOLL_CTL_MOD, 226, {EPOLLIN|EPOLLOUT, {u32=226, u64=226}}) = 0
2916  close(3)                          = 0
2916  munmap(0x7f9b09745000, 1044480)   = 0
2916  madvise(0x7f9b0a045000, 8368128, MADV_DONTNEED) = 0
2916  exit(0)                           = ?
2915  <... futex resumed> )             = 0
2915  write(1, "  Thread Stats   Avg      Stdev     Max   +/- Stdev\n", 52) = 52
2915  write(1, "    Latency    26.46ms   20.55ms 207.06ms   86.89%\n", 51) = 51
2915  write(1, "    Req/Sec     4.62k     2.82k    8.66k    49.46%\n", 51) = 51
2915  write(1, "  86701 requests in 10.08s, 13.06MB read\n", 41) = 41
2915  write(1, "Requests/sec:   8604.67\n", 24) = 24
2915  write(1, "Transfer/sec:      1.30MB\n", 26) = 26
2915  exit_group(0)                     = ?
```

**Comment by recoilme** [comment]
Thank you @ploxiln @azat 
I edit malloc as you suggest, but error still present

**Comment by recoilme** [comment]
I see similar errors with last memcached server - 1.4.34 
If i run this memcache test: https://github.com/antirez/mc-benchmark
With params like this: mc-benchmark -h 127.0.0.1 -p 11211 -c 200 -n 10000 -k 1
And see many read errors. Dont know what it may be... May be its normal

**Comment by azat** [comment]
@recoilme indeed it is normal behavior when other side does not close connection properly (and this is the case of `wrk`), since kernel will terminate this connection but with RST instead of FIN.

You can check it by yourself using `tcpdump`/`wireshark` and simple `nc` for example:
```
nc -z -lp 9876 &
sudo tcpdump -n -i lo port 9876 &
bash -c 'eval 4<>/dev/tcp/127.1/9876; eval 4>&-'
23:41:08.316280 IP 127.0.0.1.40366 > 127.0.0.1.9876: Flags [S], seq 3877181305, win 43690, options [mss 65495,sackOK,TS val 1019230998 ecr 0,nop,wscale 7], length 0
23:41:08.316299 IP 127.0.0.1.9876 > 127.0.0.1.40366: Flags [S.], seq 417959723, ack 3877181306, win 43690, options [mss 65495,sackOK,TS val 1019230998 ecr 1019230998,nop,wscale 7], length 0
23:41:08.316315 IP 127.0.0.1.40366 > 127.0.0.1.9876: Flags [.], ack 1, win 342, options [nop,nop,TS val 1019230998 ecr 1019230998], length 0
23:41:08.316347 IP 127.0.0.1.40366 > 127.0.0.1.9876: Flags [F.], seq 1, ack 1, win 342, options [nop,nop,TS val 1019230998 ecr 1019230998], length 0
23:41:08.316435 IP 127.0.0.1.9876 > 127.0.0.1.40366: Flags [F.], seq 1, ack 2, win 342, options [nop,nop,TS val 1019230998 ecr 1019230998], length 0
23:41:08.316448 IP 127.0.0.1.40366 > 127.0.0.1.9876: Flags [.], ack 2, win 342, options [nop,nop,TS val 1019230998 ecr 1019230998], length 0
```

P.S. there are plenty versions of nc, tested with _netcat (The GNU Netcat) 0.7.1_
P.P.S here I used `bash` for establishing tcp connection, since both of netcat calls shutdown()/close() and hence we will have RST sometimes.

**Comment by recoilme** [comment]
Thank you @azat !
I close this issue then
